{
  "schema_version": "pa_feitian_evaluation_screening_report_v1",
  "generated_at_utc": "2026-07-11T12:10:00Z",
  "provenance": {
    "role": "m6_screening_report",
    "source_manifest_path": "doc/repro/pa-feitian-m5-data-real-premium-outcomes-2026-07-10/source/pa_feitian_run_manifest_with_premium_outcome_v1.json",
    "source_manifest_sha256": "sha256:2a0b3bfdf2b1c605ba9f4d1817dbe74847d9b90c3786b51b96c69137c5d782a4",
    "source_manifest_schema_version": "pa_feitian_run_manifest_v1",
    "premium_outcome_artifact_path": "doc/repro/pa-feitian-m5-data-real-premium-outcomes-2026-07-10/source/pa_feitian_premium_outcome_v1.json",
    "premium_outcome_artifact_sha256": "sha256:addc74e48d19b9e437f639ff336f9fa0c1c1c0b5a1bdea9511be88087fe8149e",
    "premium_outcome_schema_version": "pa_feitian_premium_outcome_v1",
    "source_commit": "5c74dd4964c814f1daefa09dc9f45ac3bfcc5788",
    "producer": "engine.pa_feitian.policy_comparison.v1",
    "cli_args": [
      "src/scripts/compare_pa_feitian_m6_policies.py",
      "--baseline-dataset",
      "doc/repro/pa-feitian-m6-candidate-recovery-2026-07-11/source/pa_feitian_evaluation_dataset_baseline_v1.json",
      "--baseline-aggregate",
      "doc/repro/pa-feitian-m6-candidate-recovery-2026-07-11/source/pa_feitian_evaluation_aggregate_result_baseline_v1.json",
      "--comparison-config",
      "doc/repro/pa-feitian-m6-candidate-recovery-2026-07-11/policy_comparison_config_v1.json",
      "--candidate-input",
      "candidate_stop_30pct",
      "doc/repro/pa-feitian-m6-candidate-recovery-2026-07-11/source/pa_feitian_evaluation_dataset_candidate_stop_30pct_v1.json",
      "doc/repro/pa-feitian-m6-candidate-recovery-2026-07-11/source/pa_feitian_evaluation_aggregate_result_candidate_stop_30pct_v1.json",
      "--screening-out",
      "doc/repro/pa-feitian-m6-candidate-recovery-2026-07-11/source/pa_feitian_evaluation_screening_report_v1.json",
      "--failure-report-dir",
      "doc/repro/pa-feitian-m6-candidate-recovery-2026-07-11/source/failure_modes",
      "--generated-at-utc",
      "2026-07-11T12:10:00Z"
    ],
    "policy_config_sha256": "sha256:721b0afe79e92f84085081b012717a6db955ad8c1ef590011cbce4c48027ab22",
    "data_access_status": "real_data_available",
    "fixture_fallback": false,
    "random_seed": 7,
    "input_hashes": {
      "source_manifest": "sha256:2a0b3bfdf2b1c605ba9f4d1817dbe74847d9b90c3786b51b96c69137c5d782a4",
      "premium_outcome_artifact": "sha256:addc74e48d19b9e437f639ff336f9fa0c1c1c0b5a1bdea9511be88087fe8149e",
      "decision_intent_artifact": "sha256:340611f099007d06754a205b99c0cd7c7de989360e428a8036528486fcd711f0",
      "policy_config": "sha256:721b0afe79e92f84085081b012717a6db955ad8c1ef590011cbce4c48027ab22",
      "evaluation_dataset": "sha256:6ebcef341f7cea43036c3e2b9b609661c9a828f0992ce5793221d5a8ae6c1fba",
      "aggregate_result": "sha256:1128f718722788d50e2d2c0ce1200b32b578c94c6c4c5ad24e3e9f24d0c2b7d2",
      "policy_comparison_config": "sha256:721b0afe79e92f84085081b012717a6db955ad8c1ef590011cbce4c48027ab22",
      "policy_comparison_config_file": "sha256:dfde82038b4a52c7325920d2de22326bd12910014883161dcbc9af558c90ff24"
    },
    "output_hashes": {},
    "notes": [
      "M6-C consumed explicit baseline/candidate M6 artifacts only",
      "no score_today rerun, market scan, contract reselection, live trading, or execution occurred"
    ]
  },
  "evaluation_dataset": {
    "kind": "evaluation_dataset",
    "path": "doc/repro/pa-feitian-m6-candidate-recovery-2026-07-11/source/pa_feitian_evaluation_dataset_baseline_v1.json",
    "sha256": "sha256:6ebcef341f7cea43036c3e2b9b609661c9a828f0992ce5793221d5a8ae6c1fba",
    "schema_version": "pa_feitian_evaluation_dataset_v1",
    "content_type": "application/json"
  },
  "aggregate_result": {
    "kind": "evaluation_aggregate_result",
    "path": "doc/repro/pa-feitian-m6-candidate-recovery-2026-07-11/source/pa_feitian_evaluation_aggregate_result_baseline_v1.json",
    "sha256": "sha256:1128f718722788d50e2d2c0ce1200b32b578c94c6c4c5ad24e3e9f24d0c2b7d2",
    "schema_version": "pa_feitian_evaluation_aggregate_result_v1",
    "content_type": "application/json"
  },
  "candidates": [
    {
      "candidate_id": "candidate_stop_30pct",
      "policy_id": "pa_feitian_m6_daily_long_option_stop_30pct",
      "policy_version": "v1.retro_20260711",
      "classification": "blocked",
      "classification_basis": [
        "blocked: candidate observed event-id set differs from baseline; paired comparison would select outcomes"
      ],
      "comparable_oos_window_count": 0,
      "effective_event_count": 0,
      "baseline_policy_id": "pa_feitian_m5_daily_long_option_stop_target",
      "reviewer_status": "pending",
      "limitations": [
        "candidate observed event-id set differs from baseline; paired comparison would select outcomes"
      ],
      "comparison": {
        "comparability_status": "blocked",
        "baseline_dataset_sha256": "sha256:6ebcef341f7cea43036c3e2b9b609661c9a828f0992ce5793221d5a8ae6c1fba",
        "candidate_dataset_sha256": "sha256:1bb0aa8426aa5c65f00ae491b827308c4ddb1e0225c2fde8e361ad17bb99b1ad",
        "baseline_aggregate_sha256": "sha256:1128f718722788d50e2d2c0ce1200b32b578c94c6c4c5ad24e3e9f24d0c2b7d2",
        "candidate_aggregate_sha256": "sha256:e1a1a217f299365fcd33836d78a6448e0115ab1400dec3b1d26f70c00f8d2c4d",
        "paired_effective_event_count": 0,
        "baseline_mean_premium_r": null,
        "candidate_mean_premium_r": null,
        "mean_premium_r_difference": null,
        "median_premium_r_difference": null,
        "adjusted_bootstrap_ci": null,
        "comparable_oos_windows": [],
        "limitations": [
          "candidate observed event-id set differs from baseline; paired comparison would select outcomes"
        ]
      }
    }
  ],
  "multiple_comparison": {
    "configuration_sha256": "sha256:721b0afe79e92f84085081b012717a6db955ad8c1ef590011cbce4c48027ab22",
    "method": "bonferroni",
    "family_size": 1,
    "alpha": 0.05,
    "adjusted_confidence_level": 0.95,
    "tested_candidate_count": 0,
    "unavailable_candidate_count": 1
  },
  "warnings": [
    "M6-C comparison is an audit shortlist only; no candidate is approved for execution"
  ]
}
