{
  "schema_version": "pa_feitian_evaluation_screening_report_v1",
  "generated_at_utc": "2026-07-11T00:00:00Z",
  "provenance": {
    "role": "m6_screening_report", "source_manifest_path": "src/tests/fixtures/pa_feitian_run_manifest_with_premium_outcome_v1.json", "source_manifest_sha256": "sha256:aaaaaaaaaaaaaaaaaaaaaaaaaaaaaaaaaaaaaaaaaaaaaaaaaaaaaaaaaaaaaaaa", "source_manifest_schema_version": "pa_feitian_run_manifest_v1", "premium_outcome_artifact_path": "src/tests/fixtures/pa_feitian_premium_outcome_v1.json", "premium_outcome_artifact_sha256": "sha256:bbbbbbbbbbbbbbbbbbbbbbbbbbbbbbbbbbbbbbbbbbbbbbbbbbbbbbbbbbbbbbbb", "premium_outcome_schema_version": "pa_feitian_premium_outcome_v1", "source_commit": "cccccccccccccccccccccccccccccccccccccccc", "producer": "engine.pa_feitian.evaluation_contract_fixture.v1", "cli_args": ["fixture-only-contract-test"], "policy_config_sha256": "sha256:cccccccccccccccccccccccccccccccccccccccccccccccccccccccccccccccc", "data_access_status": "fixture_fallback", "fixture_fallback": true, "random_seed": 7,
    "input_hashes": {"source_manifest": "sha256:aaaaaaaaaaaaaaaaaaaaaaaaaaaaaaaaaaaaaaaaaaaaaaaaaaaaaaaaaaaaaaaa", "premium_outcome_artifact": "sha256:bbbbbbbbbbbbbbbbbbbbbbbbbbbbbbbbbbbbbbbbbbbbbbbbbbbbbbbbbbbbbbbb", "policy_config": "sha256:cccccccccccccccccccccccccccccccccccccccccccccccccccccccccccccccc", "evaluation_dataset": "sha256:dddddddddddddddddddddddddddddddddddddddddddddddddddddddddddddddd", "aggregate_result": "sha256:eeeeeeeeeeeeeeeeeeeeeeeeeeeeeeeeeeeeeeeeeeeeeeeeeeeeeeeeeeeeeeee"}, "output_hashes": {}, "notes": ["contract fixture only"]
  },
  "evaluation_dataset": {"kind": "evaluation_dataset", "path": "src/tests/fixtures/pa_feitian_evaluation_dataset_v1.json", "sha256": "sha256:dddddddddddddddddddddddddddddddddddddddddddddddddddddddddddddddd", "schema_version": "pa_feitian_evaluation_dataset_v1", "content_type": "application/json"},
  "aggregate_result": {"kind": "evaluation_aggregate_result", "path": "src/tests/fixtures/pa_feitian_evaluation_aggregate_result_v1.json", "sha256": "sha256:eeeeeeeeeeeeeeeeeeeeeeeeeeeeeeeeeeeeeeeeeeeeeeeeeeeeeeeeeeeeeeee", "schema_version": "pa_feitian_evaluation_aggregate_result_v1", "content_type": "application/json"},
  "candidates": [{"candidate_id": "premium_stop_target_daily", "policy_id": "premium_stop_target_daily", "policy_version": "v1.fixture", "classification": "inconclusive", "classification_basis": ["one effective event", "no OOS comparison"], "comparable_oos_window_count": 0, "effective_event_count": 1, "baseline_policy_id": "premium_stop_target_daily", "reviewer_status": "pending", "limitations": ["fixture fallback", "not an automatic strategy approval"]}],
  "warnings": ["M6-A defines report structure only; no policy comparison has been run"]
}
